    <!ELEMENT studentGroup (student+)>
    <!ELEMENT student (name+, age, department)>
    <!ELEMENT name (#PCDATA)>
    <!ELEMENT age (#PCDATA)>
    <!ELEMENT department (#PCDATA)>
    <!ATTLIST student 
              id ID #REQUIRED
              isActive (true | false) "true" 
            
    >